{
  "name": "Summer Music Festival 2026 - Updated",
  "description": "An unforgettable weekend of live music and entertainment - Now with more artists!",
  "description_attribute": null,
  "full_description": "Join us for three days of incredible performances from world-class artists across multiple stages. We've added a fourth stage and extended camping options for 2026.",
  "full_description_attribute": null,
  "youtube_url": "https://youtube.com/watch?v=updated2026",
  "date_time": {
    "start": "2026-07-15T14:00:00",
    "end": "2026-07-18T02:00:00"
  },
  "location": {
    "description": "Central Park, New York, NY - Expanded Grounds"
  },
  "url": "https://summerfest2026.example.com",
  "add_tags": ["family-friendly", "workshops"],
  "remove_tags": ["camping"],
  "hidden": false,
  "logo": {
    "url": "https://example.com/logo-updated.png"
  },
  "media_items": [
    {
      "url": "https://example.com/new-stage.jpg",
      "caption": "The new electronic stage"
    },
    {
      "url": "https://example.com/camping.jpg",
      "caption": "Premium camping area"
    }
  ],
  "rrule": {
    "recurringType": 3,
    "separationCount": 1,
    "dayOfWeek": null,
    "weekOfMonth": null,
    "monthOfYear": 7,
    "dayOfMonth": 15,
    "exact": true
  },
  "remove_rrule": false,
  "message": "Updated event details with extended hours and new stages"
}
